Name,ImageUrl,ProductUrl,ProviderName,Price
Anatdol TV Console In Brown Maple Colour,/database/tv_units/Anatdol TV Console In Brown Maple Colour.png,https://www.pepperfry.com/product/anatdol-tv-units-in-brown-maple-colour-2166570.html,Pepperfry,"₹4,699"
Fenily TV Unit in Wenge Finish for TVs up to 65,/database/tv_units/Fenily TV Unit in Wenge Finish for TVs up to 65.png,https://www.pepperfry.com/product/fenily-tv-unit-in-wenge-finish-for-tvs-up-to-65-inches-1987991.html,Pepperfry,"₹17,999"
Freemont Sheesham Wood TV Console in Scratch Resistant Provincial Teak Finish for TVs up to 70,/database/tv_units/Freemont Sheesham Wood TV Console in Scratch Resistant Provincial Teak Finish for TVs up to 70.png,https://www.pepperfry.com/product/freemont-sheesham-wood-tv-console-in-provincial-teak-finish-for-tvs-up-to-70-inches-1231141.html,Pepperfry,"₹31,999"
Kibo Tv Unit In Lyon Walnut Finish for TV's upto 55'',/database/tv_units/Kibo Tv Unit In Lyon Walnut Finish for TV's upto 55''.png,https://www.pepperfry.com/product/kibo-tv-unit-in-lyon-walnut-finish-2215342.html,Pepperfry,"₹23,099"
Skiddo TV Unit In Brown Maple & White Finish For TV Upto 50 Inch,/database/tv_units/Skiddo TV Unit In Brown Maple & White Finish For TV Upto 50 Inch.png,https://www.pepperfry.com/product/skiddo-tv-unit-in-brown-maple-white-finish-for-tv-upto-50-inch-2152519.html,Pepperfry,"₹5,799"